{
  "schema_version": "1.0",
  "id": "credential_to_critical_path_v1",
  "version": "1.0",
  "title": "Credential use followed by critical-path approach",
  "hypothesis": "An attacker using credentials may move laterally and approach a critical asset within a short step span.",
  "source": "observed",
  "required_fields": [
    "campaign_id",
    "actor_id",
    "event_id",
    "event_type",
    "step"
  ],
  "group_by": [
    "campaign_id",
    "actor_id"
  ],
  "operations": [
    {
      "operator": "sequence",
      "items": [
        {
          "event_type": "credential_use"
        },
        {
          "event_type": "lateral_move",
          "within_steps": 3
        },
        {
          "event_type": [
            "critical_path_near_target",
            "critical_asset_reach"
          ],
          "within_steps": 5
        }
      ],
      "max_span_steps": 8,
      "overlap": false
    }
  ],
  "finding": {
    "severity": "high",
    "title": "Credential activity reached a critical path",
    "reason": "An ordered credential-use and lateral-movement sequence approached a critical asset.",
    "score": 0.85
  },
  "metadata": {
    "tags": [
      "identity",
      "critical-path",
      "sequence"
    ]
  }
}
